{
  "schemaVersion": "1.0",
  "name": "baseline",
  "description": "One block per table at a different place in the address space; large enough for the biggest request of every function.",
  "unitId": 1,
  "coils": {
    "address": 0,
    "values": [false, true, false, false, true, false, true, false, false, true, false, true, false, false, true, false, true, false, false, true, false, true, false, false, true, false, true, false, false, true, false, true, false, false, true, false, true, false, false, true, false, true, false, false, true, false, true, false, false, true, false, true, false, false, true, false, true, false, false, true, false, true, false, false, true, false, true, false, false, true, false, true, false, false, true, false, true, false, false, true, false, true, false, false, true, false, true, false, false, true, false, true, false, false, true, false, true, false, false, true, false, true, false, false, true, false, true, false, false, true, false, true, false, false, true, false, true, false, false, true, false, true, false, false, true, false, true, false, false, true, false, true, false, false, true, false, true, false, false, true, false, true, false, false, true, false, true, false, false, true, false, true, false, false, true, false, true, false, false, true, false, true, false, false, true, false, true, false, false, true, false, true, false, false, true, false, true, false, false, true, false, true, false, false, true, false, true, false, false, true, false, true, false, false, true, false, true, false, false, true, false, true, false, false, true, false, true, false, false, true, false, true, false, false, true, false, true, false, false, true, false, true, false, false, true, false, true, false, false, true, false, true, false, false, true, false, true, false, false, true, false, true, false, false, true, false, true, false, false, true, false, true, false, false, true, false, true, false, false, true, false, true, false, false, true, false, true, false, false, true, false, true, false, false, true, false, true, false, false, true, false, true, false, false, true, false, true, false, false, true, false, true, false, false, true, false, true, false, false, true, false, true, false, false, true, false, true, false, false, true, false, true, false, false, true, false, true, false, false, true, false, true, false, false, true, false, true, false, false, true, false, true, false, false, true, false, true, false, false, true, false, true, false, false, true, false, true, false, false, true, false, true, false, false, true, false, true, false, false, true, false, true, false, false, true, false, true, false, false, true, false, true, false, false, true, false, true, false, false, true, false, true, false, false, true, false, true, false, false, true, false, true, false, false, true, false, true, false, false, true, false, true, false, false, true, false, true, false, false, true, false, true, false, false, true, false, true, false, false, true, false, true, false, false, true, false, true, false, false, true, false, true, false, false, true, false, true, false, false, true, false, true, false, false, true, false, true, false, false, true, false, true, false, false, true, false, true, false, false, true, false, true, false, false, true, false, true, false, false, true, false, true, false, false, true, false, true, false, false, true, false, true, false, false, true, false, true, false, false, true, false, true, false, false, true, false, true, false, false, true, false, true, false, false, true, false, true, false, false, true, false, true, false, false, true, false, true, false, false, true, false, true, false, false, true, false, true, false, false, true, false, true, false, false, true, false, true, false, false, true, false, true, false, false, true, false, true, false, false, true, false, true, false, false, true, false, true, false, false, true, false, true, false, false, true, false, true, false, false, true, false, true, false, false, true, false, true, false, false, true, false, true, false, false, true, false, true, false, false, true, false, true, false, false, true, false, true, false, false, true, false, true, false, false, true, false, true, false, false, true, false, true, false, false, true, false, true, false, false, true, false, true, false, false, true, false, true, false, false, true, false, true, false, false, true, false, true, false, false, true, false, true, false, false, true, false, true, false, false, true, false, true, false, false, true, false, true, false, false, true, false, true, false, false, true, false, true, false, false, true, false, true, false, false, true, false, true, false, false, true, false, true, false, false, true, false, true, false, false, true, false, true, false, false, true, false, true, false, false, true, false, true, false, false, true, false, true, false, false, true, false, true, false, false, true, false, true, false, false, true, false, true, false, false, true, false, true, false, false, true, false, true, false, false, true, false, true, false, false, true, false, true, false, false, true, false, true, false, false, true, false, true, false, false, true, false, true, false, false, true, false, true, false, false, true, false, true, false, false, true, false, true, false, false, true, false, true, false, false, true, false, true, false, false, true, false, true, false, false, true, false, true, false, false, true, false, true, false, false, true, false, true, false, false, true, false, true, false, false, true, false, true, false, false, true, false, true, false, false, true, false, true, false, false, true, false, true, false, false, true, false, true, false, false, true, false, true, false, false, true, false, true, false, false, true, false, true, false, false, true, false, true, false, false, true, false, true, false, false, true, false, true, false, false, true, false, true, false, false, true, false, true, false, false, true, false, true, false, false, true, false, true, false, false, true, false, true, false, false, true, false, true, false, false, true, false, true, false, false, true, false, true, false, false, true, false, true, false, false, true, false, true, false, false, true, false, true, false, false, true, false, true, false, false, true, false, true, false, false, true, false, true, false, false, true, false, true, false, false, true, false, true, false, false, true, false, true, false, false, true, false, true, false, false, true, false, true, false, false, true, false, true, false, false, true, false, true, false, false, true, false, true, false, false, true, false, true, false, false, true, false, true, false, false, true, false, true, false, false, true, false, true, false, false, true, false, true, false, false, true, false, true, false, false, true, false, true, false, false, true, false, true, false, false, true, false, true, false, false, true, false, true, false, false, true, false, true, false, false, true, false, true, false, false, true, false, true, false, false, true, false, true, false, false, true, false, true, false, false, true, false, true, false, false, true, false, true, false, false, true, false, true, false, false, true, false, true, false, false, true, false, true, false, false, true, false, true, false, false, true, false, true, false, false, true, false, true, false, false, true, false, true, false, false, true, false, true, false, false, true, false, true, false, false, true, false, true, false, false, true, false, true, false, false, true, false, true, false, false, true, false, true, false, false, true, false, true, false, false, true, false, true, false, false, true, false, true, false, false, true, false, true, false, false, true, false, true, false, false, true, false, true, false, false, true, false, true, false, false, true, false, true, false, false, true, false, true, false, false, true, false, true, false, false, true, false, true, false, false, true, false, true, false, false, true, false, true, false, false, true, false, true, false, false, true, false, true, false, false, true, false, true, false, false, true, false, true, false, false, true, false, true, false, false, true, false, true, false, false, true, false, true, false, false, true, false, true, false, false, true, false, true, false, false, true, false, true, false, false, true, false, true, false, false, true, false, true, false, false, true, false, true, false, false, true, false, true, false, false, true, false, true, false, false, true, false, true, false, false, true, false, true, false, false, true, false, true, false, false, true, false, true, false, false, true, false, true, false, false, true, false, true, false, false, true, false, true, false, false, true, false, true, false, false, true, false, true, false, false, true, false, true, false, false, true, false, true, false, false, true, false, true, false, false, true, false, true, false, false, true, false, true, false, false, true, false, true, false, false, true, false, true, false, false, true, false, true, false, false, true, false, true, false, false, true, false, true, false, false, true, false, true, false, false, true, false, true, false, false, true, false, true, false, false, true, false, true, false, false, true, false, true, false, false, true, false, true, false, false, true, false, true, false, false, true, false, true, false, false, true, false, true, false, false, true, false, true, false, false, true, false, true, false, false, true, false, true, false, false, true, false, true, false, false, true, false, true, false, false, true, false, true, false, false, true, false, true, false, false, true, false, true, false, false, true, false, true, false, false, true, false, true, false, false, true, false, true, false, false, true, false, true, false, false, true, false, true, false, false, true, false, true, false, false, true, false, true, fa